{
  "_comment": "AREG registry entry for the Schema Commons AAIF reference example 'Invoice Chaser'. Demonstrates a published, signed, enterprise-conformant agent.",
  "sc_standard": "SC-013",
  "sc_version": "0.1.0",
  "registry_id": "a1b2c3d4-e5f6-7890-abcd-ef1234567890",
  "agent_id": "550e8400-e29b-41d4-a716-446655440001",
  "agent_version": "1.0.0",
  "published_at": "2026-06-25T00:00:00Z",
  "publisher": {
    "name": "Schema Commons",
    "url": "https://schemacommons.org",
    "public_key_url": "https://schemacommons.org/.well-known/jwks.json",
    "contact": "bob@observalytics.com"
  },
  "aaif_url": "https://raw.githubusercontent.com/Observalytics-SL/aaif/main/examples/invoice-chaser.json",
  "signature": null,
  "tags": ["finance", "invoicing", "accounts-receivable", "mcp", "enterprise"],
  "conformance_level": "Enterprise",
  "required_capabilities": ["tool.mcp", "memory.redis", "memory.postgres"],
  "acpm_profile_url": "https://raw.githubusercontent.com/Observalytics-SL/acpm/main/examples/invoice-chaser-profile.json",
  "yanked": false,
  "yank_reason": null,
  "license": "CC-BY-4.0"
}
