{
  "_comment": "AREG registry entry for the AAIF 'Research Summarizer' example agent. Demonstrates a portable, multi-provider agent with evaluation test cases.",
  "sc_standard": "SC-013",
  "sc_version": "0.1.0",
  "registry_id": "b2c3d4e5-f6a7-8901-bcde-f01234567891",
  "agent_id": "550e8400-e29b-41d4-a716-446655440002",
  "agent_version": "1.0.0",
  "published_at": "2026-06-25T00:00:00Z",
  "publisher": {
    "name": "Schema Commons",
    "url": "https://schemacommons.org",
    "public_key_url": "https://schemacommons.org/.well-known/jwks.json",
    "contact": "bob@observalytics.com"
  },
  "aaif_url": "https://raw.githubusercontent.com/Observalytics-SL/aaif/main/examples/research-summarizer.json",
  "signature": null,
  "tags": ["research", "summarisation", "web-search", "multi-provider"],
  "conformance_level": "Observable",
  "required_capabilities": ["tool.http", "memory.vector"],
  "acpm_profile_url": null,
  "yanked": false,
  "yank_reason": null,
  "license": "CC-BY-4.0"
}
